Nama SPKLU,Alamat,Waktu Operasi,Jam Buka,Jarak,Konektor,Charging Slots,Ketersediaan,Timestamp
SPKLU PLN Universitas Negeri Padang,"Padang, Air Tawar Bar., Kec. Padang Utara, Kota Padang, Sumatera Barat 25173",Buka 24 Jam,5.0,126.29 km,1/1 Konektor Tersedia,"('22 kW',)","(1,)",2025-05-15 15:52:09
SPKLU PLN PADANG ARO,"Jl. Bangun Rejo, Lubuk Gadang Sel., Kec. Sangir, Kabupaten Solok Selatan, Sumatera Barat 27778",Buka 24 Jam,0.0,141.22 km,1/1 Konektor Tersedia,"('22 kW',)","(1,)",2025-05-15 15:56:07
SPKLU PLN ULP PANGKALAN KERINCI,"JL. Akasia, Pangkalan Kerinci Bar., Kec. Pangkalan Kerinci, Kabupaten Pelalawan, Riau",Buka 24 Jam,5.0,95.96 km,1/1 Konektor Tersedia,"('22 kW',)","(1,)",2025-05-15 15:47:43
SPKLU PLN ULP KOTANOPAN,"Jl. Lintas Medan, Padang Bulan, Kec. Kotanopan, Kabupaten Mandailing Natal, Sumatera Utara 22994",Buka 24 Jam,5.0,204.28 km,1/1 Konektor Tersedia,"('22 kW',)","(1,)",2025-05-15 15:59:36
SPKLU PLN ULP RIMO,"Jl. Iskandar Muda, Rimo, Kec. Gn Meriah, Kab. Aceh Singkil, Aceh, 24791",Buka 24 Jam,0.0,475.29 km,1/1 Konektor Tersedia,"('22 kW',)","(1,)",2025-05-15 16:15:30
SPKLU PLN ULP UJUNG BATU,"Jl. Raya Ujung Batu - Bonai Darussalam, Ngaso, Kec. Ujung Batu, Kabupaten Rokan Hulu, Riau",Buka 24 Jam,5.0,139.71 km,1/1 Konektor Tersedia,"('22 kW',)","(1,)",2025-05-15 15:55:40
SPKLU ASTON LAMPUNG CITY HOTEL,"Jl. Gatot Subroto No.81, Garuntang, Kec. Telukbetung Selatan, Kota Bandar Lampung, Lampung 35228",Buka 24 Jam,4.83,721.50 km,1/2 Konektor Tersedia,"('22 kW', '22 kW')","(0, 1)",2025-05-15 16:42:32
SPKLU HOTEL NIAGARA PARAPAT,"Jl. Pembangunan No.1, Parapat, Kec. Girsang Sipangan Bolon, Kabupaten Simalungun, Sumatera Utara 21174",Buka 24 Jam,4.0,418.38 km,1/1 Konektor Tersedia,"('22 kW',)","(1,)",2025-05-15 16:11:15
SPKLU PLN ULP TANJUNG BALAI,"Jl. Jendral Sudirman, Tj. Balai Kota I, Tanjungbalai Selatan, Kota Tanjung Balai, Sumatera Utara 21334",Buka 24 Jam,1.0,395.60 km,1/1 Konektor Tersedia,"('22 kW',)","(1,)",2025-05-15 16:09:11
SPKLU PLN ULP RIMBO BUJANG,"Jl. Pahlawan, Unit 2, Wirotho Agung, Kec. Rimbo Bujang, Kabupaten Tebo, Jambi 37253",Buka 24 Jam,0.0,144.72 km,1/1 Konektor Tersedia,"('22 kW',)","(1,)",2025-05-15 15:56:48
SPKLU PELABUHAN BAKAUHENI,"Bakauheni, Kabupaten Lampung Selatan, Lampung",Buka 24 Jam,5.0,791.22 km,2/2 Konektor Tersedia,"('22 kW', '22 kW')","(1, 1)",2025-05-15 16:49:04
SPKLU PLN ULP AEK KANOPAN,"Aek Kanopan Tim., Kec. Kualuh Hulu, Kabupaten Labuhanbatu Utara, Sumatera Utara 21273",Buka 24 Jam,5.0,364.67 km,1/1 Konektor Tersedia,"('22 kW',)","(1,)",2025-05-15 16:07:00
SPKLU PLN ULP SAROLANGUN,"Jl. Abdul Manaf No.60, Ps. Sarolangun, Kec. Sarolangun, Kabupaten Sarolangun, Jambi",Buka 24 Jam,5.0,273.20 km,1/1 Konektor Tersedia,"('22 kW',)","(1,)",2025-05-15 16:02:26
SPKLU PLN ULP PARAPAT,"Jl. Bangun Dolok Nomor 14 Girsang Sipangan Bolon, Simalungun, Sumatera Utara",Buka 24 Jam,4.29,418.95 km,5/5 Konektor Tersedia,"('22 kW', '25 kW', '25 kW', '50 kW', '50 kW')","(1, 1, 1, 1, 1)",2025-05-15 16:11:34
SPKLU PLN MK CAR WASH,"Jl. Lintas Utama Sumatera No.km 3, Sungai Rumbai, Kec. Sungai Rumbai, Kabupaten Dharmasraya, Sumatera Barat 27684",Buka 24 Jam,5.0,112.56 km,3/3 Konektor Tersedia,"('50 kW', '50 kW', '22 kW')","(1, 1, 1)",2025-05-15 15:50:10
SPKLU PLAZA ANDALAS,"Jalan Pemuda ( Plaza Andalas Lt.2 No.11 Kel, Jl. Blk. Olo, Olo, Kec. Padang Bar., Kota Padang, Sumatera Barat",Buka 24 Jam,0.0,128.99 km,1/1 Konektor Tersedia,"('22 kW',)","(1,)",2025-05-15 15:54:11
SPKLU PLN ULP PERDAGANGAN,"Jl. Rajamin Purba, Perdagangan I, Kec. Bandar, Kabupaten Simalungun, Sumatera Utara 21184",Buka 24 Jam,0.0,439.79 km,1/1 Konektor Tersedia,"('22 kW',)","(1,)",2025-05-15 16:13:02
SPKLU PLN ULP MUARA LABUH,"Jalan Batang Lawe, Muara Labuh, Pasir Talang Bar., Kec. Sungai Pagu, Kabupaten Solok Selatan, Sumatera Barat 27776",Buka 24 Jam,0.0,135.06 km,1/1 Konektor Tersedia,"('22 kW',)","(1,)",2025-05-15 15:54:47
SPKLU PLN KP BONJOL,"Jalan Trans Sumatera Bukittinggi - Padang Sidempuan No. 93, Ganggo Hilia, Bonjol, Ganggo Mudiak, Kec. Bonjol, Kabupaten Pasaman, Sumatera Barat 26381",Buka 24 Jam,0.0,124.45 km,1/1 Konektor Tersedia,"('22 kW',)","(1,)",2025-05-15 15:51:38
SPKLU PLN GH LAHAT,"Jalan Kol. H.Burlian  Kel.Bandar Jaya Kec.Lahat Kabupaten Lahat, Sumatera Selatan 31412",Buka 24 Jam,4.92,460.30 km,3/3 Konektor Tersedia,"('22 kW', '50 kW', '50 kW')","(1, 1, 1)",2025-05-15 16:13:57
SPKLU PLN ULP PAGAR ALAM,"Jalan Ulu Rurah, Pagar Alam Selatan, Kota Pagar Alam, Sumatera Selatan",Buka 24 Jam,0.0,468.52 km,1/1 Konektor Tersedia,"('22 kW',)","(1,)",2025-05-15 16:15:00
SPKLU PLN ULP KENTEN,"Palembang, Suka Maju, Kec. Sako, Kota Palembang, Sumatera Selatan 30961",Buka 24 Jam,0.0,484.18 km,1/1 Konektor Tersedia,"('22 kW',)","(1,)",2025-05-15 16:17:02
SPKLU PLN ULP JANTHO,"Jl. Jenderal Sudirman, Jantho, Aceh Besar, Aceh",Buka 24 Jam,5.0,885.35 km,1/1 Konektor Tersedia,"('22 kW',)","(1,)",2025-05-15 17:20:32
SPKLU Hotel Umega,"Jl. Trans Sumatera Km. 200, Gunung Medan, Muara Bungo - Solok, Kabupaten Dharmasraya, Sumatera Barat 27573",Buka 24 Jam,5.0,88.28 km,1/1 Konektor Tersedia,"('22 kW',)","(1,)",2025-05-15 15:46:24
SPKLU HOTEL SIBAYAK BERASTAGI,"Jl. Merdeka, Gundaling I, Kec. Berastagi, Kabupaten Karo, Sumatera Utara 22156",Buka 24 Jam,4.79,495.39 km,1/1 Konektor Tersedia,"('22 kW',)","(1,)",2025-05-15 16:21:28
SPKLU CityView Medan,"Jl. Komodor Muda Adi Sucipto, Suka Damai, Kec. Medan Polonia, Kota Medan, Sumatera Utara",Buka 24 Jam,4.26,515.41 km,2/3 Konektor Tersedia,"('50 kW', '50 kW', '22 kW')","(0, 1, 1)",2025-05-15 16:23:23
SPKLU PLN ULP BIREUEN,"Jalan Medan - Banda Aceh Cot Gapu, Geulanggang Baro, Kec. Kota Juang, Kabupaten Bireuen, Aceh 24261",Buka 24 Jam,3.29,792.57 km,2/2 Konektor Tersedia,"('50 kW', '50 kW')","(1, 1)",2025-05-15 16:49:20
SPKLU KANTOR DINAS ESDM,"Jl. Angkatan 45 No.2440, Palembang, Sumatera Selatan",Buka 24 Jam,0.0,484.78 km,1/1 Konektor Tersedia,"('7 kW',)","(1,)",2025-05-15 16:17:18
SPKLU PLN ULP BAGAN BATU,"Bagan Batu, Kec. Bagan Sinembah, Torgamba, Kab. Labuhanbatu Selatan, Sumatera Utara",Buka 24 Jam,4.88,240.62 km,1/1 Konektor Tersedia,"('30 kW',)","(1,)",2025-05-15 16:01:34
SPKLU RUMAH BUMN JAMBI,Jl. Sukarno Hatta No.35-36 Paal Merah Pasir Putih Jambi Selatan Jambi,Buka 24 Jam,5.0,298.46 km,1/1 Konektor Tersedia,"('7 kW',)","(1,)",2025-05-15 16:05:09
SPKLU KANTOR BUPATI PASAMAN,"Jl. Jend. Sudirman, Pauah, Kec. Lubuk Sikaping, Kabupaten Pasaman, Sumatera Barat 26318",Buka 24 Jam,0.0,135.13 km,1/1 Konektor Tersedia,"('22 kW',)","(1,)",2025-05-15 15:55:03
SPKLU PLN ULP PENDOPO,"Jalan Merdeka Talang Ubi Selatan Pendopo, Kab. Penukal Abab Lematang Ilir, Sumatera Selatan 31212",Buka 24 Jam,0.0,435.32 km,1/1 Konektor Tersedia,"('22 kW',)","(1,)",2025-05-15 16:12:01
SPKLU PLN UIW SUMBAR,"Jl. Dr. Wahidin No. 8 Sawahan, Kota Padang, Sumatera Barat",Buka 24 Jam,4.91,127.19 km,3/3 Konektor Tersedia,"('22 kW', '60 kW', '60 kW')","(1, 1, 1)",2025-05-15 15:53:55
SPKLU PLN UID RIAU & KEPRI,"Labuh Baru Barat, Payung Sekaki, Kota Pekanbaru, Riau 28292",Buka 24 Jam,4.86,87.51 km,2/3 Konektor Tersedia,"('50 kW', '50 kW', '22 kW')","(0, 1, 1)",2025-05-15 15:45:44
SPKLU REST AREA 56B TOL Palembang - Prabumulih,"Ruas TOL Palembang - Prabumulih, Kabupaten Ogan Ilir, Sumatera Selatan",Buka 24 Jam,3.0,494.98 km,1/1 Konektor Tersedia,"('22 kW',)","(1,)",2025-05-15 16:21:02
SPKLU PLN KP SEI PAKNING,"Jl. Sungai Selari, Kec. Bukit Batu, Kabupaten Bengkalis, Riau",Buka 24 Jam,5.0,204.85 km,1/1 Konektor Tersedia,"('30 kW',)","(1,)",2025-05-15 16:00:02
SPKLU PLN ULP AIR MOLEK,"Jl Sultan Ibrahim, Candirejo, Kec. Pasir Penyu, Kabupaten Indragiri Hulu, Riau",Buka 24 Jam,5.0,110.03 km,1/1 Konektor Tersedia,"('30 kW',)","(1,)",2025-05-15 15:49:55
SPKLU PLN UP3 LANGSA,"Jl. Jend. Ahmad Yani No.6, Gp. Jawa, Langsa Kota, Aceh",Buka 24 Jam,4.5,643.41 km,3/3 Konektor Tersedia,"('22 kW', '100 kW', '100 kW')","(1, 1, 1)",2025-05-15 16:37:03
SPKLU PLN UP3 DUMAI,"Jl. Jend. Sudirman No.185b, Bintan, Kota Dumai, Riau",Buka 24 Jam,4.85,216.43 km,2/3 Konektor Tersedia,"('50 kW', '50 kW', '22 kW')","(0, 0, 0)",2025-05-15 16:00:52
SPKLU SOLOK PREMIERE HOTEL SYARIAH,"Jl. Nasir Sutan Pamuncak, Ps. Pandan Air Mati, Kec. Tj. Harapan, Kota Solok, Sumatera Barat 27322",Buka 24 Jam,5.0,90.43 km,1/1 Konektor Tersedia,"('22 kW',)","(1,)",2025-05-15 15:46:50
SPKLU WING HUB KUALANAMU,"Komplek Hub, Kualanamu Hub Commercial Bizpark, Jl. Arteri Kualanamu No.9, Tumpatan Nibung, Kec. Batang Kuis, Kabupaten Deli Serdang, Sumatera Utara 20372",Buka 24 Jam,4.6,509.90 km,5/5 Konektor Tersedia,"('22 kW', '60 kW', '60 kW', '60 kW', '60 kW')","(1, 1, 1, 1, 1)",2025-05-15 16:22:52
SPKLU PLN ULP PANGKALAN BALAI,"Pangkalan Balai, Banyuasin III, Kab. Banyuasin, Sumatera Selatan",Buka 24 Jam,3.5,449.87 km,1/1 Konektor Tersedia,"('22 kW',)","(1,)",2025-05-15 16:13:38
SPKLU Rest Area KM 20 A Tol Bakauheni-Terbanggi Besar,"Rest Area KM 20 A Tol Bakauheni-Terbanggi Besar, Kuripan, Kec. Penengahan, Kabupaten Lampung Selatan, Lampung 35592",Buka 24 Jam,4.85,772.96 km,3/3 Konektor Tersedia,"('22 kW',)","(1,)",2025-05-15 16:48:38
SPKLU Taman AeroSport,"Jl. Kaharuddin Nst No.169c, Perhentian Marpoyan, Kota Pekanbaru, Riau",Buka 24 Jam,0.0,84.45 km,1/1 Konektor Tersedia,"('22 kW',)","(1,)",2025-05-15 15:45:02
SPKLU MALL PELAYANAN PUBLIK JAMBI,"Jalan Paal Lima, Kota Baru, Kota Jambi",Buka 24 Jam,5.0,296.15 km,1/1 Konektor Tersedia,"('22 kW',)","(1,)",2025-05-15 16:04:38
SPKLU PLN ULP MUARA DUA,"Jl. Ahmad Yani No.102, Bumi Agung, Kec. Muara Dua, Kabupaten Ogan Komering Ulu Selatan, Sumatera Selatan 32211",Buka 24 Jam,0.0,562.78 km,1/1 Konektor Tersedia,"('22 kW',)","(1,)",2025-05-15 16:30:39
SPKLU REST AREA KM 116 B LAMPUNG TENGAH,"SPKLU Rest Area km 116 B, Bumi Ratu Nuban, Lampung Tengah",Buka 24 Jam,4.66,686.55 km,3/3 Konektor Tersedia,"('22 kW',)","(1,)",2025-05-15 16:38:49
SPKLU PLN HILLPARK SIBOLANGIT,"Jl. Jamin Ginting, Sikeben, Kec. Sibolangit, Kabupaten Deli Serdang, Sumatera Utara 20357",Buka 24 Jam,3.5,498.90 km,1/1 Konektor Tersedia,"('25 kW',)","(1,)",2025-05-15 16:21:58
SPKLU PLN ULP TEMBILAHAN,"Jl. Gn. Daek, Tembilahan Kota, Kec. Tembilahan, Kabupaten Indragiri Hilir, Riau",Buka 24 Jam,4.83,205.69 km,1/1 Konektor Tersedia,"('30 kW',)","(1,)",2025-05-15 16:00:17
SPKLU Rest Area KM 172-B Tulang Bawang Barat,"Rest Area KM 172-B Tulang Bawang Barat, Lampung",Buka 24 Jam,4.44,643.55 km,4/4 Konektor Tersedia,"('22 kW', '50 kW', '50 kW', '22 kW')","(1, 1, 1, 1)",2025-05-15 16:37:23
SPKLU PLN REST AREA KM 65B,"Tanah Raja, Kec. Sei Rampah, Kabupaten Serdang Bedagai, Sumatera Utara 20986",Buka 24 Jam,5.0,489.61 km,2/2 Konektor Tersedia,"('100 kW', '100 kW')","(1, 1)",2025-05-15 16:19:30
SPKLU PLN PANDAN VIEW,"Jln. Mandeh, Ampang Pulai, Koto XI Tarusan, Kabupaten Pesisir Selatan, Sumatera Barat 25654",Buka 24 Jam,5.0,140.94 km,1/1 Konektor Tersedia,"('22 kW',)","(1,)",2025-05-15 15:55:56
SPKLU PLN UPDL TUNTUNGAN,"Jl. Lap. Golf No.35, Kp. Tengah, Kec. Pancur Batu, Kabupaten Deli Serdang, Sumatera Utara 20353",Buka 24 Jam,5.0,515.20 km,1/1 Konektor Tersedia,"('22 kW',)","(1,)",2025-05-15 16:23:13
SPKLU THE TRADERS MEDAN,"Jl. Kapten Patimura No.423, Darat, Kec. Medan Baru, Kota Medan, Sumatera Utara 20153",Buka 24 Jam,5.0,517.86 km,1/1 Konektor Tersedia,"('22 kW',)","(1,)",2025-05-15 16:24:10
SPKLU SIDE WALK COFFEE,"Jl. Jendral Sudirman.279 Payolinyam, Kaning Bukik, Kota Payakumbuh, Sumatera Barat 26217",Buka 24 Jam,0.0,73.76 km,1/1 Konektor Tersedia,"('22 kW',)","(1,)",2025-05-15 15:41:09
SPKLU PLN UID LAMPUNG,"Jl. ZA. Pagar Alam No.5, Rajabasa, Kota Banjar Lampung, Lampung 35144",Buka 24 Jam,4.88,711.26 km,3/3 Konektor Tersedia,"('100 kW', '100 kW', '22 kW')","(1, 1, 1)",2025-05-15 16:40:16
SPKLU PLN KP PANTI,"Jl lintas Panti, Panti, Kabupaten Pasaman, Sumatera Barat 26352",Buka 24 Jam,0.0,157.41 km,0/1 Konektor Tersedia,"('22 kW',)","(0,)",2025-05-15 15:57:25
SPKLU Rest Area KM 33 A Tol Bakauheni-Terbanggi Besar,"Rest Area KM 33 A Tol Bakauheni-Terbanggi Besar, Suka Tani, Kec. Kalianda, Kabupaten Lampung Selatan, Lampung 35551",Buka 24 Jam,4.4,760.78 km,0/1 Konektor Tersedia,"('22 kW',)","(0,)",2025-05-15 16:47:43
SPKLU Rest Area KM 20 B TRANS-SUMATERA,"Rawi, Kec. Penengahan, Lampung",Buka 24 Jam,4.07,772.81 km,5/5 Konektor Tersedia,(),(),2025-05-15 16:48:22
SPKLU Rest Area KM 65 B Pekanbaru - Dumai,"Jl. Tol Pekanbaru - Dumai No. KM 65 B, Tengganau, Kec. Pinggir, Kabupaten Bengkalis, Riau 28784",Buka 24 Jam,4.5,154.18 km,0/3 Konektor Tersedia,"('50 kW', '50 kW', '22 kW')","(1, 1, 0)",2025-05-15 15:57:14
SPKLU PLN ULP BALIGE,"Jl. Dr. T.D. Pardede No.14, Kec. Balige, Toba, Sumatera Utara 22312",Buka 24 Jam,5.0,382.23 km,3/3 Konektor Tersedia,"('22 kW', '60 kW', '60 kW')","(1, 1, 1)",2025-05-15 16:08:56
SPKLU SKAY WAY COFFEE,"Jl. Raya Bukittinggi - Payakumbuh No.233, Pakan Sinayan, Kec. Payakumbuh Bar., Kota Payakumbuh, Sumatera Barat 26224",Buka 24 Jam,5.0,73.95 km,0/1 Konektor Tersedia,"('22 kW',)","(0,)",2025-05-15 15:41:35
SPKLU Hotel Prime Park,"Jl. Jendral Sudirman No 3, Simpang Tiga, Kota Pekanbaru, Riau",Buka 24 Jam,0.0,85.20 km,1/1 Konektor Tersedia,"('22 kW',)","(1,)",2025-05-15 15:45:22
SPKLU REST AREA KM 67 A Tol Bakauheni-Terbanggi Besar,"SPKLU REST AREA KM 67 A Tol Bakauheni-Terbanggi Besar,Serdang, Kec. Tj. Bintang, Kabupaten Lampung Selatan, Lampung 35361",Buka 24 Jam,0.0,728.31 km,1/1 Konektor Tersedia,"('22 kW',)","(1,)",2025-05-15 16:43:33
SPKLU PLN ULP PAYAKUMBUH,"Jl. Moh. Yamin, Padang Tiakar Hilir, Kec. Payakumbuh Timur, Kota Payakumbuh, Sumatera Barat 26212",Buka 24 Jam,4.67,73.81 km,1/1 Konektor Tersedia,"('22 kW',)","(1,)",2025-05-15 15:41:19
SPKLU PLN ULP STABAT,"Jl. Proklamasi, Kwala Bingai, Kec. Stabat, Kabupaten Langkat, Sumatera Utara 20811",Buka 24 Jam,5.0,547.17 km,1/1 Konektor Tersedia,"('22 kW',)","(1,)",2025-05-15 16:30:13
SPKLU Kantor ULP Talang Padang,"Jl. Raden Intan No.76, Suka Merindu, Kec. Talang Padang, Kabupaten Tanggamus, Lampung 35377",Buka 24 Jam,5.0,682.05 km,1/1 Konektor Tersedia,"('22 kW',)","(1,)",2025-05-15 16:38:23
SPKLU PLN ULP Muratara,"Lawang Agung, Kec. Rupit, Kab. Musi Rawas Utara, Sumatera Selatan",Buka 24 Jam,0.0,319.90 km,1/1 Konektor Tersedia,"('22 kW',)","(1,)",2025-05-15 16:05:35
SPKLU PLN ULP PANGKALAN BRANDAN,"Brandan Tim. Baru, Kec. Babalan, Kabupaten Langkat, Sumatera Utara 20881",Buka 24 Jam,4.0,582.17 km,1/1 Konektor Tersedia,"('22 kW',)","(1,)",2025-05-15 16:34:32
SPKLU PLN ULP RENGAT KOTA,"Jl. Laksamana Laut Yos Sudarso, Sekip Hulu, Kec. Rengat, Kabupaten Indragiri Hulu, Riau 29314",Buka 24 Jam,0.0,138.62 km,1/1 Konektor Tersedia,"('22 kW',)","(1,)",2025-05-15 15:55:29
SPKLU PLN ULP JEURAM,"Desa Simpang Peut, Kec. Kuala, Kabupaten Nagan Raya, Aceh 23681",Buka 24 Jam,0.0,740.32 km,1/1 Konektor Tersedia,"('22 kW',)","(1,)",2025-05-15 16:44:10
SPKLU PLN S2JB Demang,"Jalan Demang Lebar Daun No. 170 Palembang, Sumatera Selatan",Buka 24 Jam,4.74,483.59 km,4/4 Konektor Tersedia,"('30 kW', '22 kW', '60 kW', '60 kW')","(1, 1, 1, 1)",2025-05-15 16:16:52
SPKLU PLN ULP Tebing Tinggi,"Jl. Jend. Sudirman No.287, Badak Bejuang, Tebing Tinggi Kota, Sumatera Utara",Buka 24 Jam,4.7,465.78 km,5/5 Konektor Tersedia,"('22 kW', '25 kW', '25 kW', '50 kW', '50 kW')","(1, 1, 1, 1, 1)",2025-05-15 16:14:44
SPKLU PLN ULP BLANG PIDIE,"Desa Pantai Perak, Susoh, Kabupaten Aceh Barat Daya, Aceh 237633",Buka 24 Jam,0.0,667.24 km,1/1 Konektor Tersedia,"('22 kW',)","(1,)",2025-05-15 16:38:07
SPKLU TRANSMART PEKANBARU B,"Jl. Musyawarah No.11, Labuh Baru Tim., Kec. Payung Sekaki, Kota Pekanbaru, Riau 28292",Buka 24 Jam,4.0,87.77 km,1/1 Konektor Tersedia,"('22 kW',)","(1,)",2025-05-15 15:45:59
SPKLU PLN ULP SIMPANG TIGA,"Jl. Kartama, Perhentian Marpoyan, Kec. Marpoyan Damai, Kota Pekanbaru, Riau",Buka 24 Jam,4.93,81.79 km,1/1 Konektor Tersedia,"('22 kW',)","(1,)",2025-05-15 15:44:05
SPKLU PLN ICON + SBU SBT,"Jl. Soekarno - Hatta, Sidomulyo Tim., Kota Pekanbaru, Riau",Buka 24 Jam,3.17,82.30 km,1/1 Konektor Tersedia,"('30 kW',)","(1,)",2025-05-15 15:44:31
SPKLU PLN ULP LUBUK BASUNG,"Lubuk Basung, Kec. Lubuk Basung, Kabupaten Agam, Sumatera Barat 26452",Buka 24 Jam,0.0,141.67 km,1/1 Konektor Tersedia,"('22 kW',)","(1,)",2025-05-15 15:56:22
SPKLU PLN ULP TAKENGON,"Jl. Lebe Kader No.89, Simpang Empat, Kec. Bebesen, Kabupaten Aceh Tengah, Aceh",Buka 24 Jam,4.0,736.00 km,1/1 Konektor Tersedia,"('25 kW',)","(1,)",2025-05-15 16:43:59
SPKLU PLN KP RIMBO DATA,"Tanjuang Balik, Kec. Pangkalan Koto Baru, Kabupaten Lima Puluh Kota, Sumatera Barat 26272",Buka 24 Jam,0.0,78.92 km,1/1 Konektor Tersedia,"('22 kW',)","(1,)",2025-05-15 15:43:13
SPKLU PLN REST AREA KM 65A,"Tanah Raja, Kec. Sei Rampah, Kabupaten Serdang Bedagai, Sumatera Utara 20986",Buka 24 Jam,5.0,489.77 km,2/2 Konektor Tersedia,"('A CCS2', 'B CCS2')","(1, 1)",2025-05-15 16:19:41
SPKLU PLN ULP LIMA PULUH KOTA,"Koto Tuo, Kec. Harau, Kabupaten Lima Puluh Kota, Sumatera Barat 26271",Buka 24 Jam,0.0,73.24 km,1/1 Konektor Tersedia,"('22 kW',)","(1,)",2025-05-15 15:40:43
SPKLU PLN ULP KOTABARU,"‎‎Jl‎.  ‎Nuri Jelutung‎, ‎Kota Jambi‎, ‎36133‎",Buka 24 Jam,4.0,296.26 km,1/1 Konektor Tersedia,"('22 kW',)","(1,)",2025-05-15 16:04:54
SPKLU PLN ULP SUNGAI PENUH,"Jl. RE Martadinata No.1 Kota Sungai Penuh, Jambi",Buka 24 Jam,3.5,197.27 km,1/1 Konektor Tersedia,"('22 kW',)","(1,)",2025-05-15 15:59:26
SPKLU KAPEL KRUI,"Labuhan Jukung, Krui, Kp. Jawa, Kec. Pesisir Tengah, Kabupaten Pesisir Barat, Lampung 34874",Buka 24 Jam,0.0,616.17 km,1/1 Konektor Tersedia,"('22 kW',)","(1,)",2025-05-15 16:35:34
SPKLU Rest Area KM 36 B Bangkinang - Pekanbaru,"Jl. Tol Pekanbaru - Bangkinang KM 36 B, Muara Jalai, Kec. Bangkinang, Kabupaten Kampar, Riau 21184",Buka 24 Jam,1.0,81.77 km,0/3 Konektor Tersedia,"('50 kW', '50 kW', '22 kW')","(0, 0, 0)",2025-05-15 15:43:39
SPKLU MALL BOEMI KEDATON,"Jl. Teuku Umar No.1, Labuhan Ratu, Kec. Kedaton, Kota Bandar Lampung, Lampung 35132",Buka 24 Jam,3.63,714.87 km,2/2 Konektor Tersedia,"('25 kW', '22 kW')","(1, 1)",2025-05-15 16:41:01
SPKLU PLN PLTD SEUNEUBOK,"Meulaboh, Seuneubok, Kec. Johan Pahlawan, Kabupaten Aceh Barat, Aceh 23617",Buka 24 Jam,0.0,758.85 km,1/1 Konektor Tersedia,"('22 kW',)","(1,)",2025-05-15 16:47:07
SPKLU MASJID H. ALIUS,"Koto Gaek Guguak, Kec. Gn. Talang, Kabupaten Solok, Sumatera Barat 27365",Buka 24 Jam,5.0,106.36 km,1/1 Konektor Tersedia,"('22 kW',)","(1,)",2025-05-15 15:49:21
SPKLU PLN ULP PASIR PANGARAIAN,"Jl. Koperasi No.3, Pasir Pengaraian, Rambah Tengah Utara, Kabupaten Rokan Hulu, Riau",Buka 24 Jam,5.0,169.24 km,1/1 Konektor Tersedia,"('30 kW',)","(1,)",2025-05-15 15:57:54
SPKLU HOTEL EMERALD MEDAN,"Jl. KL. Yos Sudarso No.1, Silalas, Kec. Medan Bar., Kota Medan, Sumatera Utara 20235",Buka 24 Jam,5.0,519.91 km,1/1 Konektor Tersedia,"('22 kW',)","(1,)",2025-05-15 16:27:01
SPKLU PLN ULP MEULABOH KOTA,"Jl. Geureute I, Kuta Padang, Kec. Johan Pahlawan, Kab. Aceh Barat, Aceh",Buka 24 Jam,0.0,756.06 km,1/1 Konektor Tersedia,"('22 kW',)","(1,)",2025-05-15 16:45:48
SPKLU PLN MESJID SYUHADA PALANGKI,"Simpang 4 palangki, Koto Baru, Kec. IV Nagari, Kabupaten Sijunjung, Sumatera Barat 27564",Buka 24 Jam,5.0,65.96 km,1/1 Konektor Tersedia,"('22 kW',)","(1,)",2025-05-15 15:40:17
SPKLU PLN ULP MUARA TEBO,"Jl. H. Mansyur Desa Baru Muara Tebo, Kab Muara Tebo, Jambi",Buka 24 Jam,4.0,183.82 km,1/1 Konektor Tersedia,"('22 kW',)","(1,)",2025-05-15 15:59:11
SPKLU PLN ULP BRASTAGI,"Jl. Udara No.7, Gundaling I, Berastagi, Gundaling I, Kec. Berastagi, Kab. Karo, Sumatera Utara",Buka 24 Jam,4.71,494.09 km,2/2 Konektor Tersedia,"('30 kW', '30 kW')","(1, 1)",2025-05-15 16:20:36
SPKLU PLN ULP SEI RAMPAH,"Jl. Medan - Tebing Tinggi No.300, Firdaus, Kec. Sei Rampah, Kabupaten Serdang Bedagai, Sumatera Utara 20995",Buka 24 Jam,0.0,482.40 km,1/1 Konektor Tersedia,"('22 kW',)","(1,)",2025-05-15 16:16:11
SPKLU (ARISTA POWER) MERCEDES BENZ ARISTA MEDAN,"Jl. T. Amir Hamzah No.49, Sei Agul, Kec. Medan Bar., Kota Medan, Sumatera Utara 20117",Buka 24 Jam,4.91,521.05 km,2/2 Konektor Tersedia,(),(),2025-05-15 16:27:47
SPKLU PLN ULP BANGKINANG,"Jl. Langgini, Kec. Bangkinang, Kabupaten Kampar, Riau",Buka 24 Jam,5.0,75.22 km,1/1 Konektor Tersedia,"('30 kW',)","(1,)",2025-05-15 15:42:11
SPKLU PLN ULP PRABUMULIH,"Jl. Diponegoro, Muara Dua, Kec. Prabumulih Timur,  Kota Prabumulih, Sumatera Selatan",Buka 24 Jam,5.0,477.48 km,1/1 Konektor Tersedia,"('22 kW',)","(1,)",2025-05-15 16:15:55
SPKLU IBI DARMAJAYA,"Jl. ZA. Pagar Alam No.93, Gedong Meneng, Kec. Rajabasa, Kota Bandar Lampung, Lampung 35141",Buka 24 Jam,4.0,713.87 km,1/1 Konektor Tersedia,"('22 kW',)","(1,)",2025-05-15 16:40:42
SPKLU Kantor Gubernur Provinsi Riau,"Jl. Jend. Sudirman No.460, Jadirejo, Kec. Sukajadi, Kota Pekanbaru, Riau 28121",Buka 24 Jam,4.48,89.72 km,1/2 Konektor Tersedia,"('A CCS2', 'B CCS2')","(0, 1)",2025-05-15 15:46:40
SPKLU PLN ULP BATUSANGKAR,"Jl. Ps. Papan, Baringin, Kec. Lima Kaum, Kabupaten Tanah Datar, Sumatera Barat 27212",Buka 24 Jam,5.0,81.46 km,1/1 Konektor Tersedia,"('22 kW',)","(1,)",2025-05-15 15:43:28
SPKLU PLN UP3 PAYAKUMBUH,"Jl. Raya Bukittinggi - Payakumbuh 48, Daya Bangun, Kec. Payakumbuh Bar., Kota Payakumbuh, Sumatera Barat 26218",Buka 24 Jam,4.69,75.31 km,0/3 Konektor Tersedia,"('50 kW', '50 kW', '22 kW')","(0, 0, 0)",2025-05-15 15:42:26
SPKLU PLN UP3 SOLOK,"Jl. Prof Dr Hamka, Kota Solok, Sumatera Barat",Buka 24 Jam,4.85,92.47 km,3/3 Konektor Tersedia,"('22 kW',)","(1,)",2025-05-15 15:47:33
SPKLU PLN UP3 BINJAI,"Jl. Tengku Amir Hamzah No.37, Pahlawan, Kec. Binjai Utara, Kota Binjai, Sumatera Utara 20748",Buka 24 Jam,4.38,532.33 km,3/3 Konektor Tersedia,"('7 kW', '30 kW', '30 kW')","(1, 1, 1)",2025-05-15 16:29:28
SPKLU PLN ULP SIAK SRI INDRAPURA,"Kp. Dalam, Kec. Siak, Kabupaten Siak, Riau",Buka 24 Jam,5.0,145.19 km,1/1 Konektor Tersedia,"('30 kW',)","(1,)",2025-05-15 15:56:58
SPKLU HOTEL SANTIKA LAHAT,"Jl. Lubuk Beringin No.138, Kel.Manggul, Kec. Lahat, Kabupaten Lahat, Sumatera Selatan",Buka 24 Jam,5.0,461.20 km,1/1 Konektor Tersedia,"('22 kW',)","(1,)",2025-05-15 16:14:07
SPKLU PLN ULP LUBUK LINGGAU,"Jl. Yos Sudarso No.5,  Kota Lubuk Linggau, Sumatera Selatan",Buka 24 Jam,5.0,375.56 km,3/3 Konektor Tersedia,"('22 kW', '60 kW', '60 kW')","(1, 1, 1)",2025-05-15 16:07:58
SPKLU HOTEL MERCURE BENGKULU,"Jl. S. Parman No.27, Padang Jati, Kec. Ratu Samban, Kota Bengkulu, Provinsi Bengkulu 38227",Buka 24 Jam,5.0,403.74 km,1/1 Konektor Tersedia,"('22 kW',)","(1,)",2025-05-15 16:10:18
SPKLU PLN ULP TEUNOM,"Desa Panton, Kec. Teunom, Kabupaten Aceh Jaya, Aceh 23653",Buka 24 Jam,0.0,803.93 km,1/1 Konektor Tersedia,"('22 kW',)","(1,)",2025-05-15 16:49:46
SPKLU KAMPUS UNAND 2 PYK,"Jl. Rangkayo Rasuna Said, Kubu Gadang, Kec. Payakumbuh Utara, Kota Payakumbuh, Sumatera Barat 26218",Buka 24 Jam,5.0,74.12 km,1/1 Konektor Tersedia,"('22 kW',)","(1,)",2025-05-15 15:41:45
SPKLU PLN ULP TARUTUNG,"Jl. Guru Mangaloksa No.113, Hutauruk, Kec. Tarutung, Kabupaten Tapanuli Utara, Sumatera Utara 22452",Buka 24 Jam,5.0,365.31 km,1/1 Konektor Tersedia,"('22 kW',)","(1,)",2025-05-15 16:07:09
SPKLU PLN HOTEL EMERSIA,"Jl. Hamka No.41Jorong Parak Juar, Jl. Hamka No.60, Baringin, Kec. Lima Kaum, Kabupaten Tanah Datar, Sumatera Barat 27211",Buka 24 Jam,5.0,81.78 km,1/1 Konektor Tersedia,"('22 kW',)","(1,)",2025-05-15 15:43:54
SPKLU PLN ULP MANNA,"JL. Fatmawati,Kampung Baru, Kec. Kota Manna, Kabupaten Bengkulu Selatan, Bengkulu",Buka 24 Jam,0.0,494.32 km,1/1 Konektor Tersedia,"('22 kW',)","(1,)",2025-05-15 16:20:52
SPKLU PLN ULP AMPERA,"Jl. Gub. H.A. Bastari  Jakabaring, Palembang, Sumatera Selatan",Buka 24 Jam,4.88,489.97 km,1/1 Konektor Tersedia,"('7 kW',)","(1,)",2025-05-15 16:19:56
SPKLU PLN ULP LHOKSEUMAWE KOTA,"Jl. Malikussaleh No.1, Lancang Garam, Kec. Banda Sakti, Kota Lhokseumawe, Aceh 24351",Buka 24 Jam,5.0,760.90 km,0/1 Konektor Tersedia,"('7 kW',)","(0,)",2025-05-15 16:47:59
SPKLU PLN ULP MUKOMUKO,"Jl. R.A. Kartini No.8, Pd. Batu, Kec. Kota Mukomuko, Kabupaten Mukomuko, Bengkulu",Buka 24 Jam,0.0,254.63 km,1/1 Konektor Tersedia,"('22 kW',)","(1,)",2025-05-15 16:01:55
SPKLU ULP MEDAN SUNGGAL,"Jl. Bunga Raya No.11, Asam Kumbang, Kec. Medan Sunggal, Kota Medan, Sumatera Utara 20128",Buka 24 Jam,4.29,520.51 km,1/1 Konektor Tersedia,"('22 kW',)","(1,)",2025-05-15 16:27:33
SPKLU PLN ULP KUALA TUNGKAL,"‎‎Jl‎. ‎Beringin No‎. ‎78 ‎Kec Tungkal Ilir, Kab Tanjung Jabung Barat, Jambi 36514‎",Buka 24 Jam,0.0,247.52 km,1/1 Konektor Tersedia,"('22 kW',)","(1,)",2025-05-15 16:01:45
SPKLU Rest Area KM 208 A Tol Terpeka,"Rest Area KM 208 A Tol Terpeka, Warga Indah Jaya, Kec. Banjar Agung, Kab. Tulang Bawang, Lampung 34684",Buka 24 Jam,4.5,617.10 km,1/1 Konektor Tersedia,"('22 kW',)","(1,)",2025-05-15 16:35:49
SPKLU PLN UP3 SIGLI,"Jl. Tgk. Chik Di Tiro No.14, Aceh 24114",Buka 24 Jam,5.0,863.55 km,2/2 Konektor Tersedia,"('7 kW', '25 kW')","(1, 1)",2025-05-15 16:58:20
